,id,date,dateYear,dateMonth,dateDay,rating,content
1143,1144,20200219,2020,02,19,1,지문을 추가 등록한 것도 아니고 지문 인식이 안됨. 또 어플 첫 화면이 흰색에서 나타나질 않음... 어플 업데이트가 필요한듯 함
1144,1145,20210209,2021,02,09,1,이체시 OTP 인증 마치면서 구체적인 사유 없이 Exception 이라고만 딸랑 띄워버리고 진행 안되어버리면 노답입니다. 고객 떨어져나가는거 보기 싫다면 당장 개선이 시급해보입니다. 정말 중요한 거래시 이래버리면 진심 누구든 폭발합니다.
1145,1146,20190116,2019,01,16,1,네트워크 오류 너무 심합니다. 쏠도 그렇고 미니뱅크도 그런데 제 스마트폰 문제 입니까... 그게 아니라 앱상문제면 빨리 해결해줘야되는거 아닙니까 며칠째 네트워크 오류네요..
1146,1147,20190504,2019,05,04,1,"""삼성패스에 등록된 지문정보가 아닙니다"" 라는 문구가나오면서 지문로그인이 안됩니다 바이오인증센터에서 재등록하면 재등록시 사용한손가락지문으로만 로그인이 됩니다 4개의 지문을 등록해서 사용하는데 신한은행어플에서만 이러한 증상이 있습니다"
1147,1148,20200102,2020,01,02,2,아니 팀뷰어가 뭐 불법프로그램입니까? 팀뷰어가 백그라운드에서 작동중인 것도 아니고 설치만 되어있는걸로 이체를 못하게 막다니 도대체.. 업무용으로 설치해놓은건데 이체할때마다 지우고 쓰라구요? 말이 되는 소릴해야지 도대체가. 빠른 시일내에 수정 안되면 다른 은행앱으로 옮기고 말겠습니다. 어차피 오픈뱅킹 도입돼서 어느 은행 앱을 써도 상관없는데 이런 식으로 유저를 내쫓네요.
1148,1149,20201210,2020,12,10,1,다중계좌이체 불가능하게바뀐건가요?? 급여일에 이체해야할곳이 한두군데가 아닌데 하나보내고 비번입력하고 하나보내고 비번입력하고 너무 불편해요ㅠㅠ 추가이체를 도저히 찾을수없어서 일단 이체완료하니 나오네요.. 추가이체가 거기있으면 의미가 있을까요..?? 비번 누르는것도 일이에요...
1149,1150,20210713,2021,07,13,1,왜 신한플러스 인터페이스를 바꿉니까? 너무 불편해요. 업데이트전이 훨씬 직관적이고 이용하기 편했는데... 투자메뉴를 2번이상 눌러야 찾아들어갈수있고 그마저도 어디있는지 헤매야 하고... 제발 전버전으로 롤백해주세요.
1150,1151,20200414,2020,04,14,3,신한플러스 기본화면에서 바로 들어갈 수 있게 만들어 주세요. 맞춤메뉴 설정에도 없는데.. 완전 불편해요
1151,1152,20211208,2021,12,08,1,신분증 찍히면 뭐합니까 자꾸 오류 떠서 가까운 지점 방문하라는데 그리고 영상통화 인증 계속 오류뜨고 휴대전화 번호도 변경이 된 적이 없는데 있다고 인증하라고 하고 인증하려고 하면 또 신분증 문제 생기고 이따위로 앱만들거면 걍 방문해서 인증하라고 하지 뭐하자고 인증하라고 합니까
1152,1153,20210524,2021,05,24,1,"와!!!!cccc 내가 진짜 리뷰 안쓰는데 업데이트 하고나서 도저히 못 쓰겠다. 니들이 업데이트 맘대로 하게만들어 놓고. 상담사연결 하려니 통화가 많아서 대기대기,,, 대기는 이해하겠는데 톡 상담하려니까 화면이 하얗게 되고 채팅창도 사라지면서 키판만 뜨는건 감으로 글씨 쓰라는건가? 이거 상담 하라는거 말라는거? 내폰 이상이라고 우기지마세요!! 비번도 on으로 해놔도 매번 입력해야하고 나는 키움으로 간다. 이거 안해!"
1153,1154,20211209,2021,12,09,5,와이파이가 빵빵한데 어떻게 네트워크가 불안정 하냐고.. 기기변경 하고 번호 변경하는데 비대면 상담사는 연결도 안되고 8번은 넘게 한듯...더러워서 못쓰겠네..신한 아니 답변 참..LTE로도 해봤는데 뭔 소리이신지..정말로...
1154,1155,20201124,2020,11,24,2,"이체금액 계좌번호 한 화면에 보이는 게 더 편했던 거 같아요~ 그건 둘째치고 V3가 자동실행이 안 되네요, 쏠앱실행하면 V3가 자동 연동 실행되어 상단에 아이콘으로 표시되었었는데 안 되요~왜 그런가요?"
1155,1156,20201125,2020,11,25,1,아 이체하고 싶어도 금액 입력하면 자꾸 튕기고 에러나서 며칠째 이체를 못하고있는데 동일한 증상 보이는사람한테 답글도 깽뚱한거 달고있어ㅡㅡ 오류 수정을 하든지 폰을껏다켜도 안되는데 뭐어쩌라고 앱삭제하고 깔았더니 저장되어 있는 정보 다 날아가서 전부다 다시등록해야하는데 진짜 미치도록 번거롭게 만드네 이체한번 하자고 이게 뭔 뻘짓중이야 짜증나게
1156,1157,20210716,2021,07,16,1,아니 ㅆ8 바로이체 가입해서 2년넘게 잘쓰다가 얼마전에 앱 업데이트했는데 바로이체 안되고 가입하라해서 봤더니 정상적으로 가입중인데 개스트레스받게 바로이체가 계속 안되네
1157,1158,20220127,2022,01,27,2,잘 사용해왔는데 어제 8시쯤부터 실행되지가 않고 앱이 계속 중단된다고만 뜹니다. 12시간이 훨씬 지났는데도 안돼요. 어제 친구의 앱은 실행되더라구요. 앱이 실행이 안되니 고객지원센터에 문의하지 못하고요. 지금 해보니 다른 은행 앱은 잘 열리고 신한앱만 안돼요. 업데이트 때문에 오류가 생긴 것도 아닌 거 같은데 답답합니다
1158,1159,20200914,2020,09,14,1,아이디 로그인이 되지않습니다 아이디 비번 제대로 입력하면 공인인증서가 필요하답니다 아무 거래도 진행하지 않는데요 그래서 인증서 비번 입력하면 계좌번호 넣으라하고 계좌 비번까지 넣으라 하고 도대체 끝도 없네요 도대체 왜 아이디 로그인이 안되는지 이해가 안되네요
1159,1160,20200723,2020,07,23,5,"신한 쏠을 사용중인데 너무 편하고,좋아합니다. 작심3일이란 적금과 스마트적금을 하고 있는데,월 한도 내에서 수시로 적금하는것데,풋돈에서 목돈도 금방 만들수 있어서 좋아요.자세한 내용은 신한쏠(sol)에 들어가셔서 확인하셔도 되고,상담사에게 문의 해도 좋을 듯 합니다. 모두모두 부자 되세요~^^"
1160,1161,20200506,2020,05,06,1,휴대폰변경(갤럭시s20) 했는데 쏠 실행하니 인증서 실명번호 와 원장의 실명번호가 상이합니다 라고 뜨고 화면이 멈춥니다 은행방문해봐도 모르시는 눈치 더라고요 해결방법없을까요?? 신한알리미는 실행이됩니다 휴대폰도 초기화 및 쏠어플도 재다운해봤네요
1161,1162,20220130,2022,01,30,1,본인인증 오류때문에 어플 사용도 못합니다 인터넷 연결상태며 다 정상적이고 혹시 몰라 어플 업데이트도 다시 해봤는데 몇번을 시도해도 본인인증이 안되네요 참 곤란합니다
1162,1163,20200923,2020,09,23,1,계좌상세조회가 너무 늦게 뜹니다. 계좌상세조회가 뜨는데 1분은 넘게 걸리는 것 같습니다. 그리고 계좌상세조회 내역을 볼려고 아래로 내리면 엄청 버벅거립니다. 예전에 안그랬는데 지금은 왜 이러는지 모르겠습니다. 빨리 고쳐주세요. 너무 불편합니다!
1163,1164,20201225,2020,12,25,1,로그인을 해도 계속 로그인화면으로 넘어가고 정식인증앱이 아니라고 튕기네요. 모바일OTP이용중라 PC에서도 이체를못하고 어이가 없네요... 저와 주변인들에게 신한은 주거래은행으로는 절대 거래하지말것을 추천드립니다.
1164,1165,20201023,2020,10,23,1,비대면 인증 너무 안 돼요. 신분증 사진만 수십 번 찍었어요. 배경을 바꾸고 조명도 바꾸면서 찍어도 판독을 못하네요. 신분증 인식 겨우 됐다 해도 영상 통화할 때 소리가 안들렸어요. 문제 빨리 해결해주세요. 답답해요.
1165,1166,20190319,2019,03,19,1,어플 무겁고 느리고 가끔 꺼지기까지 해서 쓰기 싫음 PC로 이체하려니까 모바일OTP 인증받으라고 하면서 로그아웃됨 PC이용 자체가 불가능해진 것이고 무조건 어플을 쓰라는건데 이렇게 불편해서야 세상 짜증남 월급계좌라서 월2~3회 정도 어쩔 수 없이 쓰지만 쓸때마다 카***크가 훨씬 편하고 좋다는것만 일깨워주는 어플
1166,1167,20211214,2021,12,14,1,폰번호도 변경됬고 한 10년가까이 되가는 계좌가 있길래 써볼려고 들어가니 비대면 인증 진행하라 해서 신분증 인식 힘들게 시키고 이번엔 영상통화를 진행 하는데 진짜 장난 1도 없이 3일간 30번씩 했습니다 근데 계속 되는 멘트는 통신상태 불안정..어쩌고 저쩌고... 폰도 최고급 기종에 KT 5G요금제중 제일 비싼 요금제 사용중이고 혹시 몰라서 와이파이까지 잡기도 했는데 왜 안되는거죠??ㅋㅋ 진짜 별 한개도 아깝네요...
1167,1168,20190711,2019,07,11,4,"모든 기능은 좋지만, 쏠의 저장용량을 150MB이하로 수정 부탁드려도 될까요? 기능 몇가지 추가한다고 저장용량이 200MB이상이될수 없다고 생각하네요. 은행앱을 150MB중심 아래로 설치 부탁드립니다. 또한 200~300MB이상이 안되게 좀 수정부탁드립니다."
1168,1169,20181201,2018,12,01,5,"회사에서 Treasury 업무를하고있어 이은행 저은행 어플같은걸 써볼일이 많은데 다른은행보다 개발자들이 정말 열심히 하는게 눈에 보이는 은행어플입니다 단지 신한은행은 쓸데없는 어플같은걸 추가하지 말고 주력으로 하나를 잘 밀고나가는게 좋을것같습니다 (사용자 입장에서는 대체 뭘 다운받고 써야되는지 헷갈림) 스마트폰 생체인식 오류가 있었고 느렸었는데 점점 나아지는걸 보니 피드백도 빠르고 발전하는게 보입니다 아마 과도기였겠지요 편리함, 최고의 인터페이스는 신한은행 어플에서 시작되고 그 많은 은행에서도 신한이 먼저 주도하는것 같습니다 앞으로도 꾸준한 성장 기대할게요 곰캐릭터도 넘 귀여워요"
1169,1170,20190731,2019,07,31,3,다 잘쓰고있었는데 지문인증 아직 지문 대지도 않았는데 5번틀렸다고 사라지더니 다시 등록해야하는데 그럼 또 귀찮게 보안카드봐야하고 다시 등록해야하는데 이짓을 지금 몇번을 한지 모르겠습니다 한번등록해둔걸 5번저절로틀린것도 골아픈데 아니 이걸 왜 또 다시 인증해야하는겁니까
1170,1171,20210126,2021,01,26,1,아니 장난하는것도아니고 해외있어서 한국번호불가한데 로그인 재등록해야한다해서 하는중에 폰번호 인증으로 하라고 하고 그아래 보니 다른방법있다길래 들어가봤는데 영통으로 신분증검사 어쩌구있어서 그걸로하려하니깐 일시적 오류만뜨고 그러면 해외에서 폰번호없음 어케증명하라는건가요! 고객센터 연락할라하니깐 로그인하라하고 로그인하려하면 저따구고뭐어쩌란거에요 이메일같은거라도있음 연락드리게 답장좀
1171,1172,20190711,2019,07,11,1,이체하려고 문자 인증번호 입력하라고 해서 문자 확인하고 앱 들어가면 다시 처음부터 계속 앱 다시시작되고 도대체 이체를 어떻게 하라는 건지 초기에는 바로 인증번호 입력되더니 이체를 하라는건지 말라는건지 벌써 10번 넘게 반복하고 있네요....
1172,1173,20190504,2019,05,04,1,하 너무 속터져서리뷰남깁니다 약 3개월사용하고있는데 로그인화먄왜자꾸뜨는거에요 비밀번호입력해도 로그인화면으로 자꾸되돌아오고 로딩창에서 다음화면으로 안넘어가서 멀할수가없네요이런일이 한 두번이면 이면참고넘어가는데 먼 계속자주되니 짜증이 더납니다 진짜로
1173,1174,20191102,2019,11,02,1,벌서 두번째 앱 삭제후 다시 까는 중입니다. 오픈뱅킹 앖뎃 이후로 로인도 안되고.... 삭제후 다시 깔면 몇일은 됩니다. 다시깔았는데 이체하는데 왜 보안카드가 나오냐고 그전에는 비밀 번호만 눌렀는데... 진 짜 업뎃 그지같네여
1174,1175,20200405,2020,04,05,1,지금 원래 패턴 로그인 했었는데 갑자기 지문으로 바뀌고 지문 인식도 안 되고 아이디 로그인하니 이체도 안 되서 패턴 신규 등록 하려니 번호인증까지는 되는데 보안카드 번호입력 때 키보드가 안 나와서 숫자를 못 쳐요 나머지 버튼은 다 반응하는데 어플 사용을 못하고 있습니다
1175,1176,20220225,2022,02,25,2,아니 어플 왜케 느려졌어요? 무슨 모뎀도 아니고 이체하는데 계속 로딩뜨고 넘어가질 않아?그리고 최근 이체했던 내역도 왜케 많이 사라짐? 빨리 해결해주세요 답답해요
1176,1177,20220314,2022,03,14,1,아니 지금 몇 번째 시도해도 왜 로그인 안되는거에요? 한동안은 지문인증해도 뭐 에러메시지 자꾸 뜨더만 이제 아예 로그인 조차 안되네요. 주거래은행인데 이제 짜증나서 다릌거로 바꾸고싶네요
1177,1178,20220714,2022,07,14,2,항상 오류가 많더니 이젠 먹통..
1178,1179,20200823,2020,08,23,5,우선 신한쏠 하나로 해결되는거 너무 맘에 듭니다! 이것저것 계속 세분화된 앱설치가 아니라서요! 다만 제가 좀 둔해서인지 원하는거 찾기 좀 버벅거리고 있네요! 곧 익숙해지겠죠! 만족합니다!
1179,1180,20220211,2022,02,11,1,비대면 영상통화 왜 자꾸 실패했다고 하나요?전처럼 음성이라도 나오던지..이건 뭐 문자로만 나오다가 또 실패!또 실패!5번째하는데 짜증나서 하겠어요?잔액조회 해야 하는데.. 화가 막 나서 다시 지우고 재설치합니다!인내심 테스트 하는것도 아니고 제발 시정해 주세요!!
1180,1181,20200611,2020,06,11,1,급할 때 찾게 되는데 급할 때 안 열리는 앱 시작할 때 극강의 로딩중으로 인내심 테스트를 하고 들어가는 앱 대기화면이랑 친구 먹을 기세입니다 리뷰 같은 거 절대 안 쓰는데 몇 주째 지 혼자서 로딩만 무한대로 반복되거나 로딩에 지쳐서 끄고 다른 앱 들어가니까 그제야 갑자기 튀어나오는 기이한 현상을 몇번이고 맛본 끝에 씁니다. 신한은행이 주 거래 은행이 아니었다면 당장 지워버리고 싶은 앱입니다.
1181,1182,20210831,2021,08,31,1,"핸폰바꿔서 다시 시작하는데 휴대폰인증 단계에서 인증번호요청 그게 안됩니다. 몇번이고 다시 깔고 다시 하고,그래도 인증번호 문자가 안와요 모든 금융권 모든 인증번호필요한 어플 중 유일하게 여기!신한만 안되요 여기만! 이게 고급기술도 아니고!!"
1182,1183,20191226,2019,12,26,1,"갤럭시 폴드는 테스트 안하셨나봐요. 오픈뱅킹 등록하고 타행계좌 탭을 누르면 ""꾹이체는 이렇게~~""라는 화면이 가로막고 있어서 아무것도 안보여요. 뒤로가기 해서 다른 일은 할 수 있긴 한데...타행계좌는 조회 안됩니다. 갤럭시 폴드 고객도 좀 챙겨주세요.~~"
1183,1184,20200214,2020,02,14,1,지문인식도 너무 안되고(폰 자체적으로는 잘됨) 지문인식 쓰레기네요... 로그인 안되서 간편 비번 씁니다... 말이됩니까 이게? 폰 여는것도 다 지문인데. .어휴.. 키면 흰색화면에 먹통이고.. 어플 다 껐다가 켜도 안되고.. 급할때 어쩌라는거죠.. 10년 넘게 농협 썼는데.. 농협보다 안좋네요.. 짜증만..
1184,1185,20220314,2022,03,14,1,"신한 인증서를 사용하게 하기위해 일반 전화 인증은 먹통이고 쯩이라는 신한,농협등이 만든 앱에서 신한 인증서를 새로 만들어서 인증을 받으라는 내용이네요. 왜 안되는지 몰라 유선으로 문의하니 이체가 안될수도 있으니 지우고 새로 깔면 문제없다고 해서 새로 깔고 공인인증서로 로그인해서 들어가니 이체 한도 기본으로 대폭 줄고 원래대로 하려면 은행 방문하랍니다. 그래도 일단 작동은 정상이어서 앱에서 나갔다가 다시 들어가니 업그레이드가 또!!! 왜 바쁜 고객을 열흘씩 고생시킵니까? 3월4일부터 업그레이드로 사용할때마다 전화 인증번호가 안떠서 통신사하고 여러번 통화하고 결국 은행은 앱을 새로 깔으라 해서 은행을 방문하게 하는군요. 이런 피해는 어떻게 보상받아야 하나요? 후기에 보니 저와같은 불만이 많은듯 합니다.그냥 신한 인증서 사용하는 방법이라고 하세요.수많은 고객들이 업그레이드라는 미명하에 얼마나 많은 시간을 허비하고 있는지 반성하시고 빨리 풀어주세요."
1185,1186,20220516,2022,05,16,2,종료버튼이 없어 종료 불가 그래서 강제 종료
1186,1187,20200221,2020,02,21,5,[ b o o m ] 오픈폭탄 이벤트 쏠쏠 너무 편리하고 좋습니다. 속도빠릅니다 신한 쏠 은행 어플은 한 번씩은 다 써봤는데 제일 좋은 것 같음 어플때문에 주거래 은행 신한으로 ~ 쏠이 정말편하고좋아요 타은행에 비해 아주 편리함 오픈폭탄 초대만신한쏠 아주 만족하면서 쓰고 있습니다 해도 1000원 주니깐 너무 좋네요. 계좌로자동 입금 까지되니!
1187,1188,20210125,2021,01,25,1,"저 13년도 부터 SOL 쓰면서 대기 화면을 오늘 처음보내요;; 고객센터 전화연결은 안되고.. 불과 한달에서 2주전까지만해도 로그인도 빠르고 어플에서 카드없이 출금신청도 빨라서 자주애용했고 주거래은행인데.. 아니..이게 무슨일인가요? 신한카드 판어플은 빠른데, 메인인 은행이.. 심지어 인증서 로그인했는데 제출을 완료 못했다고 튕겨서 재접속하니 13분대기로 늘어나는건.. 뭐죠?"
1188,1189,20211022,2021,10,22,1,1. 예금 통장 만들면 이체한도에 걸리고 하루 30만원 출금 가능 2. 한도 풀려면 어떻게 햐야하는지 고객센터 전화하니 지점 방문하라고 함 3. 두번 가기 싫어서 필요서류 물어보니 정해진게 없으니 방문해서 물어보라고 함 4. 대리점 방문 하니 1년동안은 무조건 한도 못 풀어준다고 함 월급 세번 들어온 기록 있으면 약간 풀어주고 1년 월급 기록 있으면 완전히 풀어준다고 함 5. 월급 통장으로 만든다 쳐도 1년동안 빼서 쓸수가 없는데 어쩌라는건지.. 신한은행 쓰지 말라는 얘긴가
1189,1190,20200925,2020,09,25,1,업데이트 후 지문인증이 안됩니다. 에러코드 9998 바이오인증서 처리 결과가 정상이 아닙니다. 라고 뜨고 재등록시에도 마찬가지 에러가 떠서 등록도 안됩니다.
1190,1191,20181015,2018,10,15,1,S알리미와 더불어 최악의 앱이다. 과장 하나도 안 보태서 거의 100번 실행했는데 단 한 번도 실행된 적이 없다. 앱을 이따위로 만들 거면 제발 때려치길. 신한 앱은 전부 이런 쓰레기들만 모여있는지 궁금하다.
1191,1192,20191023,2019,10,23,3,지문등록 후 잘 썼는데요. 오늘 계속 바이오 인증 안되었다고 재설정하라는 메시지 나와요.재등록했어도 여전히 또 바이오인증 등록하라고... 이게 왜 이래요? 해제한 적도 없는데 없어지고 재등록해도 인식 못하고 겁나네요.어케 해결하나요
1192,1193,20210726,2021,07,26,1,"모바일 OTP 스스로 삭제되어서 재발급 받으려고 하니까 이체한도 설정하는 곳에서 무한 오류 걸림. 전화 인증 다 하고, 마지막 단계에서 확인 버튼 눌러도 다음 단계 절.대. 안 넘어감. 이것 때문에 주 이체 은행 바꾸고 싶음 ㄹㅇ"
1193,1194,20210310,2021,03,10,1,(구 공인인증서) 갱신할라고 모바일 OTP인증하래서 인증요청하고 쏠 드가서 인증/보안 눌렀는데 그러고 나서는 계속 빈화면만 뜨고 아무것도 안되잖아요. 업데이트 했는대도.. 장난합니까??!!!!! 한두번도 아니고!!!!
1194,1195,20220629,2022,06,29,1,2~3달전부터 렉걸려서 로그인을 할수가 없어요.
1195,1196,20201125,2020,11,25,1,이런거 진짜 안쓰는 편인데 업뎃하고 나니 이체 자체가 안되서 써요 다른 편의성이고뭐고 기본 기능은 되도록 해야하지 않나요? 금액 적고 확인 누르면 화면 멈추다가 어플이 혼자서 꺼져요 월말이라 이체할곳 많은데 결국 카카오로 다 처리하고 있어요
1196,1197,20220702,2022,07,02,3,신한플러스 언제까지 기다려야 하나요? 접속안될때 마다 로그아웃 해야 하나요
1197,1198,20190128,2019,01,28,2,어제부터 네트원크 오류라며 접속이 안됩니다. 다른 은행 앱은 다 정상작동하는데 말이죠. 앱을 지웠다 다시 설치해도 안 되네요. 이 문제 때문에 은행업무를 못 보고 있습니다. 저만 그런건지는 모르겠지만 해결해 주시기 바랍니다.
1198,1199,20200925,2020,09,25,1,사용자 정말 우롱하는 앱.. 별 하나도 아까움.. 뭐 업뎃하였다고 하면 로그인 에러 나기 부지기 수.. 확인도 하지 않고 업뎃 배포해서 사용자한테 필드 테스트 하나? 정말. 거지같다..
1199,1200,20191111,2019,11,11,1,공인증서 모바일 이미지가 바뀌었으면 pc 상 안내 이미지도 같이 바뀌어야하는거 아닌거요? Pc상은 변경전 이미지 네요 사용 유저인데 솔직히 저도 변경되서 당황했네요 장난하는것도 아니고 pc는 예전꺼 같이 마추어 가야 하는거 아닌가요? 실망해습니다.
1200,1201,20211002,2021,10,02,1,앱자체가 느리다 최적하 진짜 필요하다... 무슨 앱하나 키는데 1분이상 걸리냐? 이상한 팝업 일주일간 차단할수있는것도 필요해보입니다. --- 4개월 후 사용햇는데도 버튼 클릭도 잘안되고 먹통 ㅡㅡ^ 넘 느린거 아님????
1201,1202,20220228,2022,02,28,1,뭔 인증번호 오지도 않으면서 뭔 휴대폰 인증을 하래 몇개월 전이나 지금이나 이런건 해결 안하나 달라진게 없네
1202,1203,20191023,2019,10,23,2,자정쯤에 이체를 했는데 요청하신 거래에 오류가 있다는 팝업이 뜨고 공인인증서 지문등 로그인이 되질 않습니다...앱 삭제후 다시 실행해도 똑같구요......이체를 못하고있어요..로그인 되야 하죠..
1203,1204,20201121,2020,11,21,1,"업데이트하고 다음으로 넘거가는게 버벅거리느라 종료,재시작이 반복되며 계좌조회,이체등의 로딩시간이 상당히 김. 몇년째 쓰면서 어플의 초기 상태보다 불안정해보임."
1204,1205,20201122,2020,11,22,3,"금액을 입력하고 이체하려고 하면 화면이 안 넘어가고, 앱이 종료됩니다. 잘 쓰고있었는데 오늘 갑자기 먹통이 됐네요. 휴대폰 전원을 다시 켜도 똑같아서 확실히 앱에 문제가 있는 것 같아요. 왜 이런 건가요?"
1205,1206,20220314,2022,03,14,1,아니 저번에도 3월 1일인가 먹통됐는데 또 이러네 고객센터 연결은 안되고 공지사항도 없고 메타버스한다고 기사는 열심히 내시네요 참 일 열심히 하십니다 기대되네요 메타버스
1206,1207,20201110,2020,11,10,1,완전 ㅆㄹㄱ 어플임. 로그인 할땐 인증서 암호 잘 되는데 대출 서류작성 인증서에는 비밀번호가 맞지않는다고 나옴 ㅋㅋㅋ 게다가 5번 틀리면 막히는것도 껏다키면 다시 리셋되서 완전 무용지물이고 혹시나 해서 인증서 비밀번호 바꿨는데도 바뀌지도 않음. 별점 한개도 아깝다.
1207,1208,20220612,2022,06,12,1,머니버스에 가입해야 퇴직연금을 볼 수 있다...왜 강제로가입시키지? 속도라도 빠르던가...느려터지고 찾기도 힘들고 할때마다 욕을 부르는..
1208,1209,20191106,2019,11,06,3,업데이트 이후에 비밀번호나 지문인식의 과정을 거지지 않고 로그인이 됩니다. 혹시 핸드폰을 분실 했을경우 큰 문제가 됩니다. 수정해주세요.
1209,1210,20210515,2021,05,15,2,아니 로그인 할 때 마다 인증서서비스를 가입하라는 내용이 뜨고 다시 약관동의하고 로그인하는게 정상은 아닌 것 같은데 계속 남아있네요...이제 막 쏠 쓰기 시작했는데 처음부터 번거롭고 불편합니다.
1210,1211,20200717,2020,07,17,5,"인출할 때 보안카드가 없어도 간단인증만으로도 돈을 뽑을수도 있고, 카드가 없어도 핸드폰만으로도 인출이 가능한 완전 편한 신한 쏠~~~!!최고에요~♡♡"
1211,1212,20191105,2019,11,05,1,잘 사용하고 있었는데 삼성패스 지문등록이 다르다고 어제오늘 두번이나 재등록 함 어플에 문제가 있는듯.. 빨리 업데이트 해주시기 바람!!!
1212,1213,20190706,2019,07,06,1,아조씨 어플리케이션이 실행이 안되요... 정확히는 백그라운드에서 실행된건 보이는데 그것뿐이지 앱 화면로딩은 커녕 그냥 반응을 안해요 ㅠ
1213,1214,20210125,2021,01,25,1,벌써 1시간째 로그인조차도 할수없게 어플이 꺼집니다. 서버오류라했다가 와이파이 문제라 했다가 이유는 그렇다고뜨는데 어플자체문제 같네요.
