,id,date,dateYear,dateMonth,dateDay,rating,content
735,736,20220311,2022,03,11,1,로그인이 안 돼서 문의하려는데 앱 민원접수도 로그인 필요하네 ㅋㅋㅋ 로그인을 위해 비밀번호 재설정 하려면 계좌번호가 필요한데 계좌번호 보려면 로그인을 해야됨. 뭔 뫼비우스의 띠도 아니고. 금융인증서 등록하려고 해도 계좌필요하고 이건 뭐 주거래은행 아닌 계좌까지 달달 외우고 다니라는건가
736,737,20220713,2022,07,13,2,어제부터 갑자기 안들어가지고 삭제후에도 안됨 지속 신한만사용하는사람
737,738,20220219,2022,02,19,1,공인인증서 복사를 장장 4번 했는데도 앱에 인식이 안되네요. 밑 리뷰들을 봤을때 개선이 시급하다 봅니다.
738,739,20220404,2022,04,04,2,어플 실행하는데 지문로그인 하면 하얀색창만 나오고 다시 재부팅되네요... 오류 수정좀 해주세요
739,740,20220225,2022,02,25,1,앱이 실행되기까지 하루 종일 걸리네요 이체 한번 하는데 로딩창만 5분동안 뜨네요 아주 욕이 절로 나오네요
740,741,20220309,2022,03,09,2,안녕하세요. 신한은행 앱을깔았서 들어가 가입을 했어요. 그런데 로그인을 하고 들어가 보니 대출을 받아라고 임금을 하라고 글이뜨네요. 사실은 저는 대출에 대해서는 뭐별로 관심도 없거니와 받으려고 하지도 않아요. 그러니 대출을 안받으면 다른건 이용할수도 없네요. 사실은 포인트를 좀 얻기위해 가입을 한건데 제가 제일로 싫어하는 대출문제가 있으니 할수없이 설치했던 신한은행 앱을 삭제했어요. 이런 불필요한 것들을 좀 고쳐 주신다면 다시 해볼수도 있을거라 봐요.
741,742,20220606,2022,06,06,1,여기 빼고 은행앱 다켜짐. 잔액 확인도 안되면 무슨 쓸모가 있나요? 신한카드사건도 그렇고 신한에 문제가 많나봐요? 하나라도 제대로 해야하지 않나요?
742,743,20220225,2022,02,25,1,폰 번호 바뀌어서 인증하려는데 사용자가 많아서 지연된다고 30분 넘게 뜨네. 이딴 앱 왜만든거임?
743,744,20220228,2022,02,28,1,진짜 제가 써 본 은행어플 중에 역대급으로 구린거 같습니다. 단순 작업에 서버가 터져가지고 못 한다는게 말이 되나 싶네요.
744,745,20220303,2022,03,03,1,이건 뭐 QA도 안하구 나온거같네요... 금융인증서 새로 만들기 하면 100프로 크래쉬나네용 UX가 제일 큰 문제인줄 알았는데 그냥 기본 QA부터 해서 버그픽스부터 하셔야겠어요~
745,746,20220430,2022,04,30,1,대체언제쯤사용할수있는건가요? 이제 이체할때수수료도쳐받네..여긴이제옷쓰겄다 추잡스러서..
746,747,20220301,2022,03,01,1,학생증 때문에 어쩔 수 없이 다운 받았는데 앱이 너무 느려요. 로딩도 너무 길고. 회원가입하려고 몇 분이나 시간을 낭비했는지 모르겠어요. 아직까지도 못 가입했어요 근데.
747,748,20220519,2022,05,19,1,실명인증을 도대체 몇번씩이나합니까 애지간히 앱쓰지말라고 노력해두셨네요
748,749,20220331,2022,03,31,1,이상한 업데이트하라고 진행하면 타행 비밀번호까지 요구하네요 어플 해킹당한줄 알았습니다.
749,750,20220725,2022,07,25,1,비대면 계좌개설 사진만 211번 찍었네; 안그래도 더워죽겠는데 직접가는게 훨 낫겠다
750,751,20220228,2022,02,28,1,"요즘들어 자주 튕기고 송금도 안되고 그러네요 저만 그런줄 알고, 리뷰를 확인하니 이런 오류가 발생하는 분들이 많은 것 같네요 10년넘게 거래하던 은행이지만 주거래 은행을 바꿀까 고민될 정도입니다."
751,752,20220308,2022,03,08,1,회원가입이 안되요 ㅋㅋ 휴대폰확인하고 하는데 전번인증 처음에하고 곰돌이 뜨더니 암것도안되네요 앱개구림
752,753,20220301,2022,03,01,1,쓰레기!!!!!업데이트하고 쓰레기됨 !내돈 이체도 못하고 무한로딩에 스피드이체는 등록된게 보이지도 않고 하루종일 먹통! 은행을 바꿔야지 그지같아서 못쓰겠네
753,754,20220225,2022,02,25,1,"업데이트(02/25) 하고 이체하면, 최근 계좌가 삭제돼 있네요? 어플 관리하는 부서 직원들 좀 어떻게 해 주세요. 능력이 안되면 외주를 주시던지요. 갈수록 앱이 허접해 져서••"
754,755,20210701,2021,07,01,1,"금융권 역대 최악의 앱. 1) 맨 처음 이용하려면 직접 전화를 걸어서 인증번호를 입력해야 되는데, 전화하고 돌아오면 앱이 꺼져있어서 이용할 수가 없다. 2) 더럽게 느리다. 청약통장을 신한으로 만들어준 부모가 원망스러움. 그나마 주거래은행이 아니라 다행. 앱 때문에라도 평생 신한에 다른 계좌는 안 만들 것임."
755,756,20220222,2022,02,22,1,비대면 계좌개설은 가능하면서도 한도제한계좌라서 풀 방법도 제한적이고 다른 금융사보다 융통성이 없네요.
756,757,20220301,2022,03,01,1,이체 한번하려는데 하~~~루종일 걸려요 우리집 인터넷 문제라기인 다른은행어플은 바로바로 되는데 대체 왜 이어플만 느린건지...^^...!
757,758,20220509,2022,05,09,5,신한에서 만든 어플은 아마 시중 모든 은행 어플에서 인터페이스가 제일 깔끔하고 예쁜것 같아요!
758,759,20211216,2021,12,16,3,전체계좌조회 누르면 신한만 보이지말고 전체계좌 바로 보이게좀 해주세요ㅠㅠ 예전엔 메뉴누르면 전체 다 보였던거 같은데 전체계좌조회-전체 를 선택해야만 다보이네요.. 자주 확인해서 그런지 매번 누르기가 너무 불편하네요
759,760,20190828,2019,08,28,1,"진짜 너무 한거 아닌가 삼성패스 지문인증 안되는거 3년도 넘은것 같은데 그래 내가 은행을 바꿔야지. 다른 모든 은행, 카드사 아무문제 없이 잘되는데 신한은행 이 어플만 이따구인지 모르겠네 무슨 등록 삼성패스 지문정보 지우라고 뜨지만 그냥 계속 시도하면 로그인되고 일반 지문으로 해도 안되고 바이오인증 지문도 안되고 일반 지문 변경하려고 다 인증하고 보안카드 입력해도 진행중 오류 났다면서 아무것도 안되네"
760,761,20200622,2020,06,22,2,어제 오후부터 데이터 연결이 불안정하다고 뜨면서 어플이 실행이 안됩니다. 와이파이로 하던 데이터로 하던 똑같이 그럽니다. 기종은 노트8 입니다.
761,762,20200304,2020,03,04,1,진짜로 은행 어플 중에서 레알 느리고 쓸모 1도 없는 어플 같다 삼성 패스 지문도 재등록하고 수십번을 해도 안되서 공인인증서로 로그인 했더니 이젠 로딩창으로 10분씩 기다려도 안뜨네 폰이 문제인가 싶어서 다시 다운받아도 똑같네 ? 인터넷 뱅킹의 편리함이 아닌 답답함을 널리 알려주셔서 감사해요 참 코로나 같네 ㅋ
762,763,20220314,2022,03,14,1,짐 급한데 접속이안댑니다. 사용자가많다는데. 업데이트해도안되고.하아...
763,764,20220314,2022,03,14,1,접속도 안되고 카드도 안되고 무슨 문제인가요? 빠른 해결 부탁드립니다.
764,765,20220222,2022,02,22,1,서버관리하는놈들 싹다 뛰어내렸으면좋겠다 관리조차안하는지 매번 오류나고 쫌만 몰리면 트래픽 터지고 개판
765,766,20191101,2019,11,01,1,"별다른 문제없이 만족스럽게 사용중이었는데, 얼마전 업데이트이후로 로그인에 문제가있습니다. 우선 지문인식이 전혀 먹히지않고 앱이 종료되서 사용자체가 안됩니다. 빨리 해결해 주세요."
766,767,20210125,2021,01,25,1,업데이트를 어떻게했길래 로그인하는것부터 안되고 3~4번 설치해야 겨우 로그인 화면 뜨고 로그인 화면 들어가도 인증방법 다시 하려하면 모바일 otp화면에서 먹통.. 진짜 불편해서 쓰지를 못하겠네요. 당장 급하게 조회해볼게있는데 하지도 못하니 답답하네요 빨리 개선해주세요.
767,768,20220706,2022,07,06,3,안드로이드9 에서 신한페스타 적금 룰렛이벤트 오류나고 실행이 안됩니다 (기종 Lm-x420n) 수정 좀 해주세요
768,769,20200804,2020,08,04,4,심플하고 깔끔한 메인디자인과 메뉴정렬로 가독성이 좋고 쉽게 볼 수 있어서 만족스럽네요. 쉬운 입출금거래와 조회 역시 만족스럽습니다. 앞으로도 신한 SOL과 오래오래 함께할게요!!
769,770,20211201,2021,12,01,3,언젠가부터 보안프로그램이 상단바에 안 뜨는데 보안 제대로 되고 있는 거 맞나요? 패턴 그리고 로그인하면 잠깐 화면이 까맣게 됐다가 화면이 다시 뜨구요. 타사 앱들은 다 안랩V3 모바일플러스가 작동 중임이 상태바에 뜨는데 신한 쏠 앱만 안 떠서 계속 이체를 못하겠네요.
770,771,20210127,2021,01,27,1,로그인 하려고 본인인증 후 추가인증에 등론된 휴대폰 번호가 예전 번호라 변경을 하려는데 번호를 입력 할 수가 없습니다. 확인을 누르니 신분증 촬영과 영상통화로 넘어가 신분확인을 다 마쳤으나 핸드폰 번호늘 바꿀 방법이 없습니다. 홈페이지에서 로그인을 할 방법이 없고... 확인부탁드립니다
771,772,20220221,2022,02,21,1,입출금 통장만들려는데 출금계좌 없다떠서 타행계좌 등록 해놔도 리스트에 뜨지도 않고 기존 있던 계좌 해지하고 다시만들려했는데 해지도 안되고 계속 똑같은짓 무한반복 시키네요 갤럭시 뒤로가기버튼도 먹지도 않고 그냥 다삭제하고 신한은 쳐다도 안볼렵니다
772,773,20220225,2022,02,25,3,앱실행이너무 더디네요업데이트되고 최근 계좌등 정보가 없어졌네요
773,774,20220321,2022,03,21,1,아니 무슨 자바 어쩌구 하는 오류 뜨면서 로그인을 할수가 없음 14일 업데이트 됐는데 그래도 똑같음.
774,775,20220419,2022,04,19,5,가계부를 제일 잘 쓰고있는데 없어진다고해서 멘붕입니다ㅠㅠ 없애실거면 쏠이랑 연동되는 가계부 앱을 새로 만들어주실 의향은 없으신가요ㅠㅠ
775,776,20220118,2022,01,18,1,주민등록증 인식에서 계속 실패. 몇번에 한번씩 인식되어서 정보 확인 후 등록 하려고 하면 전산 상의 자료와 안맞다고 다시 사진찍는 화면으로 돌아감. 거기 전산 자료는 대체 어디있는 자료죠..
776,777,20191227,2019,12,27,1,로그인하려는데 접속이 안됩니다. 업데이트까지하고 5G 와이파이존에서도 접속 자체가 안됩니다. 네트워크 오류라고 해서 껏다 키고 신한은행 지점까지 와서 해봤지만 접속이 안됩니다. 무엇이 문제일까요?
777,778,20220726,2022,07,26,5,빠르고 편리해요
778,779,20220407,2022,04,07,1,신한인증서 로그인 하는데 계속 비번쳐도 그다음 단계로 넘어가지 않아요
779,780,20190610,2019,06,10,1,야구 관련 아니었으면 설치도 안 했을 쓰레기 어플... 그리고 핸드폰 번호 바꾸는 게 왜 이렇게 절차가 복잡해요 영상통화를 몇 번이나 하고 은행 직원이랑 몇 번을 통화해도 오류났다는 창만 뜨고 직원은 자기 일 아니라고 나 몰라라.. 폰 번호 바뀌었다고 아예 로그인도 안 되고 답답해서 속 터집니다
780,781,20220531,2022,05,31,5,솔 어플이 배터리 소모가 심하답니다 업데이트 부탁드립니다 삼성써비스쎈터에서
781,782,20220310,2022,03,10,1,가입할려고 신분증으로 인증 할려하는데 비대면 화상통화 인증까지 했는데 와이파이 문제 때문에 안된다만 무한반복 와이파이 말고 그냥 데이터로 해도 안됨 재인증 할라고 신분증 촬영부터 다시 할라니 가까운 지점에서 인증하라는 말만 반복 그냥 때려친다
782,783,20220314,2022,03,14,1,아...짜증나네요 모바일통장 해지하려고 지웠다다시다운 받아서 하려하는데 인증번호받기에서 세월내월 와이파이던 5G던 LTE던 다안넘어가자너 아니저녁8시에 접속자가많아?헐..이거 누가만든거임?😡 짜증나 대기15명 근대22분넘어가도록 계속 ...
783,784,20220706,2022,07,06,5,사용이편하다 다만 조금더 편하게 ㆍㆍ
784,785,20200509,2020,05,09,1,5월들어서 앱이 너무 느립니다. 자동로그인은 커녕 원이 빙빙 돌다 끝나는경우도 많고. 먹통되는경우도 많네요. 기기는 s10-5g입니다. 접속성공 해도 접속하는데 최소 5분이상씩 걸리는것 같아요. 개선좀 해주세요.
785,786,20220225,2022,02,25,1,카드 만들 일 생겨서 회원가입 할라니까 ARS 인증에 지들 멋대로 이상한 번호 입력시켜놓고 비대면 본인인증 시키더니 연결량 많다고 인증 되지도 않습니다. 참 대단하네요.
786,787,20210125,2021,01,25,1,금일 앱 업데이트 후 접속이 안됩니다 서버오류라고만 나오고 앱 실행이 안됩니다 아래 답변보니 고객번호를 매뉴에서 선택하라는데 접속도 안되고 앱이계속 튕기는데 무슨 고객번호를 확인하나라는 건지 이해가 안됩니다 이건 앱개발자나 퍼블리셔나 누군가 소스반영잘못한거 같은데 은행거래가 안되면 어떻게 합니까
787,788,20220327,2022,03,27,1,그냥 먹통이네요. 이번기회의 주거래은행 옮겨야겠어요. 스마트폰 안정적이고 편리한 은행으로 바꿔 탑니다
788,789,20220401,2022,04,01,4,머니버스 자산 연결하는데 제가 주로 사용하는 증권사인 한국포스증권이 없어서 아쉽습니다. 또래에 대한 통계 등 볼 수 있는 내용은 재밌는데 모든 자산이 반영된 상태였으면 더 유익했을 것 같습니다.
789,790,20220706,2022,07,06,5,이벤트를 통해 상식공부 포인트 숫자 올라가는 재미가 신한 sol sol 합니다.
790,791,20210125,2021,01,25,1,어플이 로딩만 되고 열리지를 않음. 은행 어플인데 자주 점검해서 이용에 문제가 없도록 해야 하는게 아닌가요? 기업 신뢰도에 영향을 줍니다. 서버 접속에 오류가 발생했습니다. 라는 메세지만 계속 나오네요.....
791,792,20220222,2022,02,22,1,비대면 계좌 개설 할라구 하는데 다음 페이지로 넘어 가질 않네요 문자 전송 하고 다음 인증 완료 되었다고 하는데 그 페이지에서 다음으로 넘어 가질 않아요 열번은 넘게 해도 같은 현상 어제 부터 계속 해도 똑같은 현상 입니다 어풀 지우고 다시 깔아서 해도 같은 현상 리뷰 보닌깐 저와 같은 이유네요 무슨 어풀을 이런식으로 만들었는지 이해가 안가네요 카카오 뱅크 나 기업은행 처럼 그렇게 좀 만들어요
792,793,20220720,2022,07,20,1,접속이 계속 안 되요. 왜이러죠. 계좌 확인을 해야할 거 아니에요????!!!!!!!! 일하는 사람들은 은행 접속이 시간을 다투는데. 이게 무슨 짓이에요. 빨리 해결해주세요
793,794,20210608,2021,06,08,1,와 정말.. 어쩌다 신한에서 청약통장 만들어서 해지할수도 없고.. 인증서 등록하려니 OTP 등록하라고 하고 타기관 OTP등록하려니 로그인또시키고 로그인하면 접근권한 없다고 하고.. ARS연결해서 얘기 했더니 한두번 문제 있던게 아닌지 해보고 안되면 앱깔아서 돌려시도 하라고 방법 가르쳐주는데.. 그마저도 안됨.. 내일 지점 가야겠네.. 최대한 이용하고 싶지 않음.. 별하나주기도 아깝다
794,795,20220303,2022,03,03,1,이체시 보안카드 앞 2자리넣고 뒤 두자리 넣으려면 입 숫자판이 사라짐. 이후 먹통. 그럼 첨부터다시해야함. 멍멍 짜증남. 개선이 안되나?
795,796,20191028,2019,10,28,3,업데이트 이후 이체중에 계속 로그아웃됩니다 초반 로그인되고 받는사람 계좌랑 금액 쓰고 다음 화면에서 비밀번호만 치면 팅겨서 로그아웃되고 초기 화면으로 나가버립니다 빨리 송금 해야하는데 돌긋네요 이 앱 쓰면서 이렇게 불편한적은 없었는데 당황스럽네요 다른 글 보니 그분들도 같은 증상이시네요 빨리 조치 좀 부탁드립니다
796,797,20220221,2022,02,21,1,별한개도 아깝다. 앱관리 안하는구나. 비대면신규계좌개설안된다. 손님받기싫은거지
797,798,20220415,2022,04,15,1,돈 좀 써서 외주 좀 제대로 맡겨요.. 진짜 너무 느리고 답답함 창구가서 번호표 뽑고 기다리는게 반영된거 같음
798,799,20191028,2019,10,28,1,이제껏 잘 사용했는데 27일 sol 업데이트 후 간편 비밀번호로 로그인하는데 비밀번호 입력후 바로 로그인 화면으로 다시 돌아갑니다. 로그인 방법을 공인인증서 선택후 비밀번호 입력하면 로그인이 정상적으로 됩니다. 하지만 이체하려고 입금후 비밀번호4자리를 넣으면 다시 로그온 첫화면으로 다시 돌아갑니다. 아마도 비밀번호 입력화면에서 먼가 오류가 있나봅니다. 빨리 해결해주세요.
799,800,20220331,2022,03,31,1,와 업데이트이후 점점 느리고 오류뜨고 정말 성질나서 못하겠네요~
800,801,20200328,2020,03,28,1,기존사용자들은 제쳐두고 새로운폰에 맞추어 업데이트하면 어쩌라는것인지 이체잘되고 기본만 되면 된다 매번 업데이트 때문에 사용못하고 이것참 ... 버전을 두개이상 만들면될것을 문제가 많네 (구형os지원도)
801,802,20191107,2019,11,07,1,"ㅋㅋ 여행용으로 편하대서 체크카드 만들었는데 환전한 돈에서 결제금액 느리게 빠져나가는건 그렇다치고,,어떻게 남은 금액을 제대로 못알려줄까? 거기다 순서대로 빠져나가지도 않구... 이럴거면 내가 신용카드 쓰지 이걸로 왜 달러환전해서 써,,,,,ㅋㅋ 직원잘못은 아니겠고 그냥 처리되는 알고리즘이 개엉망진창 담에는 안씁니다 내가 돈계산해보기 짜증나서"
802,803,20220607,2022,06,07,1,앱이 왜이렇게 무겁나요? 퍽하면 연결안되서 너무 짜증납니다
803,804,20210113,2021,01,13,2,전에는 참 좋은데 요즘 이것저것 생겨서 그런건지... 결제화면에 지문인식하고 할때 너무 느리다 그리고 로그인할때도 지문인식도 잘안되요 와이파이든 데이터든 다 잘안되요
804,805,20220225,2022,02,25,1,느려터짐..복장터질듯..핸펀바꿔서 새로인증하는데 같은짓만 열번하는중.
805,806,20220325,2022,03,25,1,글씨너무작고 화면 너무 밝고 진짜 눈 좋은 사람들만을 위한 전유물. 요세 웬만하면 다 제공 해주는 다크모드하나만있어도 토스를 쓰지않을텐데 그냥 골때리는 어플. 만든 사람이 눈나쁜 사람은 전혀 배려하지않는 더러운 인간일듯. 인간적으로 다크모드좀 만듭시다. 어쩔 수없이 볼때마다 욕튀어나옴.
806,807,20220714,2022,07,14,1,한달동안모아놓은포인트가하루아침에사라졌어요.통장개설이벤트포인트도사라지구요.그포인트받고하루지나사라졌어요.확인바랍니다
807,808,20220225,2022,02,25,1,이따위 속도로 앱을 배포하다니. 부하테스트나 기본적인 것은 진행하지도않나보네요?? 다른 은행 이런거 하나도 없는데. 속도도 느린주제에 한도계좌풀기도 까다롭고 진짜 t rash네. 개발 담당자 징계해라
808,809,20220304,2022,03,04,5,왜들 그리 화가났는지 모르겠지만 전 적금신청도 한번에 잘..되고 다 잘되네요 ^~^ 늘 잘 사용하고 있습니다. 렉도 걸린적없고 리뷰만보면 이 어플이 깡통수준인건데 ..흠... 그정도는 아닌데 ?
809,810,20211203,2021,12,03,1,"로그인이 안됩니다 각종 전화번호,문자인증,민증인증까지 몇십번(최소10번) 해봤는데 중간에 렉걸리고 다시 처음으로 돌아옵니다 지문패턴으로 로그인하려고 전화로인증하면 모바일otp발급화면나와서 울며겨자먹기로 또 인증했는데 발급안되고 다시 처음으로 돌아옵니다 화나서 못하겠습니다 그냥 삭제하고 안쓸게요"
810,811,20220324,2022,03,24,1,인증할 때 마다 자주 안 넘어갑니다. ㅡㅡ 속도도 너무 느림
811,812,20210125,2021,01,25,1,"폰을 바꾸게 되어 새로 깔았는데, 모바일OTP 발급 부분에서 ""현재 사용자가 많아..."" 팝업이 뜨면서 안 넘어가네요. 평일 오전 9시 반에 사용자가 많아서 처리를 못한다는 건 좀 이상해서요. 몇 분 기다렸다가 해도 여전히 같은 곳에서 멈추네요. 혹시 몰라 예전 폰으로 쏠 켜봤는데 똑같이 모바일OTP 부분에서 막히네요. 일일 이체한도를 변경하고 싶을 뿐인데 새 폰은 로그인조차 안 되고 예전 폰은 로그인만 되지 모바일OTP에 막혀 한도 변경이 안 돼서 답답합니다... 11시에 다시 시도해봤더니 ""서버에서 오류가 생겼습니다"" 팝업이 뜨면서 그냥 처음부터 막히네요 ㅎㅎㅎㅎ....... 2시^^... 로그인은 되는데 또 모바일OTP에서 막히네요?ㅎㅎㅎ 사용자가 대체 얼마나 많길래 하루종일 막힐까요... 거래 제대로 이루어지는 중인 사용자가 있긴 한가요? 리뷰 보면 다 안 된다는 말밖에 안 하는데 대체 서버를 어떻게 구축하면.......ㅎㅎㅎㅎㅎㅎㅎㅎㅎ......ㅎㅎ...ㅎ...ㅎㅎㅎㅎㅎㅎㅎ"
812,813,20220302,2022,03,02,1,"리뷰 썼는데 답변 달렸다고 해서 보러왔더니 제 리뷰 내려갔어요ㅋㅋㅋ 굉장하네요. 사용자 수가 많아서 서비스 지연된다고 계속 뜨고, 간신히 넘어갔더니 갑자기 앱이 재부팅돼서 처음부터 다시 작성해야하고 관리를 잘 안하는 것 같아요. 이렇게 썼는데 리뷰가 내려가네요? 멋져요~"
813,814,20210223,2021,02,23,1,갤럭시z플립사용자입니다. 갤럭시노트에서는 정상적으로 잘되는이체가 금액쓰고 확인눌리면 계속 로딩하다가 앱이 재시작됩니다. 한두번도아니고 계~~~~~^^^속 몇일째임.어쩌다 한번만 됩니다.제발고쳐주시죠
814,815,20200717,2020,07,17,5,"신한쏠 오픈뱅킹 이벤트,쏠야구,포토제닉,승부예측,예•적금 등등 너무나도 잘 이용하고 있습니다. 신한 쏠은 앱도 너무 간편하고 편리하게 사용할수있는것같아요. 타 금융기관에 비해 절차도 복잡한것도없고 너무 좋습니다. 앞으로도 잘 이용할게요"
815,816,20220413,2022,04,13,1,앱 켜지고 화면 넘어갈 때 속도 너무 느려요..답답해요
816,817,20220415,2022,04,15,1,업데이트 이후 본인확인인증문자가 안옵니다ㅡㅡ 앱지웠더니 들어갈지지를 않네요
817,818,20220709,2022,07,09,5,어렵지 않아서 쓰기 편해요
818,819,20190802,2019,08,02,1,옛날 때는 홍채 로그인 잘 써먹다가 반년전부터 안되기 시작했고 귀찮아서 방치하다가 오늘 각 잡고 모든 방법 시행. 1신한쏠 삭제 후 재설치 최신버전 확인 2홍채 삭제 후 재등록 3삼성패스 최신버전 확인 후 홍채사용으로 설정 4신한쏠 홍채 로그인 시도했는데 삼성패스 홍채사용설정 다시 하라는 문구와 함께 접속안됨. 5삼성패스 홍체사용해지 후 바탕화면으로 나가서 모든 창 닫고 삼성패스 비번 입력하고 재접속해서 홍채사용으로 다시 설정함. 6신한쏠 홍채로그인 시도했는데 같은 이유로 접속안됨. 7핸드폰 껐다켜고 위의 과정 여러번 반복했는데 안됨. 8혈압
819,820,20220322,2022,03,22,1,현재 수많은 폰 속 어플중에 배터리 급방전을 유발하고 있는 유일한 어플이라고 확인받음...
820,821,20191102,2019,11,02,1,"업데이트 후 간편 로그인하면 ""알수없는 오류가 발생 하였습니다."" 라고 뜹니다. 공인인증서 로그인해도 같은 메세지뜨고 어플 지우고 다시 깔아도 같은 증상입니다. 빠른 조치 바랍니다."
821,822,20220404,2022,04,04,3,"자동 로그인 설정 어떻게 하나요? 설정 메뉴에서 자동로그인 설정하려하면 로그인화면에서 할수있다하고, 로그아웃하고 로그인 화면으로 가도 자동로그인 설정하는 건 안보이네요"
822,823,20190807,2019,08,07,1,스마트폰 재부팅 할 때마다 안드로이드 최적화 화면이 뜨고 재부팅하는데 15분씩 걸립니다. 앱 삭제하면 문제없고 다시 재설치해도 똑같은 문제가 발생합니다.
823,824,20220221,2022,02,21,1,"쏠로 청년 우대 적금 넣지마세요 뭐 할때마다 이미지 생성이 안된다, 새로고침 한적도 없는데 커넥션 리셋 오류가 뜨지 않나 지점 방문해서 적금 만드시는게 더 시간 아낄 듯 합니다."
824,825,20211207,2021,12,07,1,업데이트 후 무별은 못주나 싶을정도로 별로에요. 오픈뱅킹 다 연결해서 원래 자산조회할때 모든 자산 다 보이는데 하나도 안보이고 머니버스 업데이트 로딩은 10분 넘도록 안돼서 그냥 포기했습니다. 다운그레이드 하고 싶은 수준이에요. 원랜 신한이 어플 가장 편해서 여기서 다 해결했는데 이 상태로 보완 안되면 그냥 갈아타려고요
