,id,date,dateYear,dateMonth,dateDay,rating,content
278,279,20191028,2019,10,28,1,업데이트 후 갑자기 비밀번호 화면에서 넘어가질 않습니다..;;; 간편비밀번호 창에서도 안넘어가고 간편비밀번호 설정을 위해서 계좌 비밀번호 치는 창에서도 안넘어가고 심지어 계좌 비밀번호 재설정 하는 창에서도 안넘어가는데 공인인증서 발급하는 창의 계좌비밀번호는 입력했더니 되네요.. 아무래도 업데이트 후 간편비밀번호 창에서만 뭔가 문제가 있는 거 같은데.. 일단 공인인증서로 하지만 너무 번거롭습니다.. 혹시 저만 그런가요? 부디 문제 해결 부탁드립니다.
279,280,20200420,2020,04,20,2,저는 신안은행 보안카드랑 공인인증서가 원래없었어요 그래도 처음 시작할때 그런거없이도 sol을 잘 사용하고있었는데 최근 핸드폰 지문인식이 잘안돼 지문을 다시등록하니 지문정보가 변경되어 다시 로그인을 합니다 라는문구후 그다음부터 어떤 방법으로도 로그인이 안돼요 예전처럼 보안카드랑 공인인증서 등록이 없어도 로그인 하려면 어떻게 해야하나요?
280,281,20200811,2020,08,11,1,"로그인 따로 안해서 편하지만, 이체할때 너무 불편해요. 요즘 지문으로 이체하거나 승인하는 편의성있는 결제 시스템이 얼마나 많은데 지하철에서도 비밀번호를 눌러가면서 비밀번호 써야하나요? 비밀번호에 보안카드까지 누를때마다 주변에서 누가 쳐다보는건 아닌지 두리번 거려야하는 불편함좀 개선해주세요. 지문이라던지 지문+보안카드라던지 변경 건 검토좀요"
281,282,20200722,2020,07,22,4,신한은행 계좌 뿐 아니라 자기 명의의 다른은행 계좌도 등록할 수 있어 여기저기 어플 실행시킬 필요없이 신한 SOL만으로도 계좌관리를 할 수 있어 좋은것 같습니다. 거기에 수시로 이벤트도 많이 하니 어플 실행할수록 즐거움이 가득한것 같네요. 특히나 저는 야구를 좋아하는데 야구 관련 이벤트가 많이 있어 재미를 더욱 배가해주는 어플이라 생각됩니다.
282,283,20191028,2019,10,28,4,업데이트후 전체적인 디자인이나 숫자 버튼이 더 잘보이고 좋아진 것 같아요 다만 계좌전체보기할 때 입출금 총계좌 금액 예적금 총계좌잔액 요렇게 두개로 나눠있고 입출금 총잔액+ 예적음 총잔액 = 나와있지 않아요 전체적인 총 금액을 알고싶은데 업데이트 후 없어져서 너무 답답해요
283,284,20210228,2021,02,28,1,폰바꾸고 비대면실명인증 계속 시도하는중인데 인증됐다면서 이전화면으로 넘어간다는 메시지만 뜨고 비대면실명인증 화면으로 되돌아가기만 합니다. 재접해도 폰번호는 안바뀌고 로그인도 안되는데 진짜 돌아버릴것같습니다. 이 앱 로그인 하려다가 정신병만 생길 것 같네요 아이디로 로그인하려니 공인인증서가 있어야된다고 뜨고 ㅋㅋㄱㅋ 진짜 더러워서 안한다
284,285,20190409,2019,04,09,1,블랙베리 유저입니다. 기기가 등록이 해제되어있다고 한달에도 두세번씩 핸드폰 인증해서 등록 다시 해놔야하고 모바일OTP도 매번 같이 등록해야합니다... 미치겠어요 이거때문에... 매번 시도때도 없이 신분증 어두운 화면에 찍어서 촬영하고 핸드폰 인증해야한다고요. 제발 왜그런지 원인 좀 파악해서 한번 등록한 기기는 계속 등록되어있게 해주세요. 신한 주거래은행인데 어플때문에 딴 은행으로 갈아타고싶은게 말이 됩니까? 제발 수정좀 부탁드려요 제발요 제발
285,286,20201202,2020,12,02,1,이번에 업뎃이후에 다계좌이체 하려는데 한개씩 이체하려니 엄청 불편합니다. 전에 이체방식이 편했는데 왜 이런식으로 업뎃한거죠? 제가 다계좌이체를 못찾는건가요 아니면 업뎃하면서 없어졌나요 리뷰같은거 잘 안적는데 다시 돌려주십사하고 적습니다 안된다면 진지하게 은행좀 바꿔볼까 생각중입니다
286,287,20210125,2021,01,25,2,"신한쏠에 들어가려 어플을 터치했으나 ""서버에서 오류가 발생하였습니다."" 하고 들어가지질 않습니다. 업데이트도 했는데 역시 마찬가지입니다. 삭제하였다가 다시 시도하여도 마찬가지입니다."
287,288,20200526,2020,05,26,2,연금상품을 고르려는데 상품목록은 많은데 계속해서 다음 버튼을 누르고 골라야 해서 매우 불편함. 카테고리별로 보여주든지 목록을 스크롤링하도록 해주던가 해야함. 상세 정보도 한번에 스크롤링해서 볼수 있도록 개선요망함. 전 단계 이동도 너무 시간이 오래 걸림.
288,289,20190515,2019,05,15,1,"잘 쓰고 있었는데 지문인증 로그인 안됨. ""삼성패스에 오류가 있습니다. 잠시 후 다시 시도 해주세요."" 다른 앱들은 지문인식로그인 여전히 잘됨. 아주 불편함... 도대체 누가 또는 어떤 업체가 관리를 하는지 모르겠지만 기본적인 테스트를 안하는 것 같음"
289,290,20191028,2019,10,28,1,"업데이트후 1.간편로그인 안됨 2. 타행 공인증서 등록 풀림 재등록 3.전체 재설치 해서 모바일otp 재발급시 마지막에서 무한 nfilterkey 오류나와서 안됨 총평 : 새로운것 하기전에 기존꺼나 좀 똑바로 확인하고 해야지 레알 개판임 참고로 구버전 재설치 하고 싶은 분은 구글에서 ""신한 쏠 7.4.6"" 검색해서 다운받고 설치하면 됩니다."
290,291,20200524,2020,05,24,1,갤럭시20 사용 중인데 sol 앱을 실행하기만 하면 핸드폰이 먹통이 됩니다. 별다른 경고 메시지 없이 그냥 잠금화면 해제만 작동이 됩니다. 잠금화면 상의 기본 카메라 앱도 실행이 안 돼요. 다른 앱은 그런 적이 없는데 sol 앱을 실행할 때마다 핸드폰을 쓸 수가 없어서 sol 앱의 문제라고 생각이 됩니다. 개선해주세요.
291,292,20220118,2022,01,18,1,저같은 피해자가 발생하지않았으면해서 고민하다 작성합니다. 신한은행 어플은 절때 사용하지않기를 권장드려요. 새마을 우리 하나 등등 많은 은행어플 큰문제없이 써왔는데 신한은행 어플은 쓸때마다 고통스럽습니다. 쓸때마다 시스템이라 인증서를 등록해도 계속 재등록해야되고 비번은 입력이안되서 계속 실패합니다. 잘사용중인 otp카드도 신한은행에서만 만료되었다고 사용이안됩니다. 신한은행에 전화한 시간들 다합치면 1시간이상되는데 지금도 모든게 되지않아 통장 잔고도 못본채로 몇달째 지내고있네요..곧 은행점 방문해서 대출갚고 떠나긴하지만 그동안 제가 받은 고통이 너무 컷네요. 어플로 뱅킹 많이 쓰시는분은 최대한 다른 은행 골라보셔야할 것같아요. 피해자가 없길 바랍니다ㅜㅜ
292,293,20200801,2020,08,01,2,"편하게 쓰고 있어요 근데 나는 하지도 않은 지문인식을 왜 자꾸 계좌이체할때 쓰라고 하는지 모르겠어요. 다른 은행으로 옮겨야할까요? 비밀번호 잘만 눌리다가 가끔씩 지문인식하라고 계속 뜨는데 나는 지문인식 등록을 한번도 한적이 없어요. 그리고 지문인식 안될때가 얼마나 많은데 지문인싱만 하게 만들어져있어요? 다른방식으로 계좌이체, 뭐 그런거 버튼이라도 있어야 그냥 비번 치고 계좌이체를 하죠."
293,294,20201208,2020,12,08,1,핸드폰에 지문 추가등록을 했을 때 갱신을 하라고 하길래 인증 하고 otp 번호까지 입력 완료했는데 등록된 기기가 아니라고 인증이 안됩니다. otp 재발급에 별 걸 다 해봤는데도 안돼서 재설치했더니 되네요. 이런 허접한 버그가 은행 어플에 있어도 되는 건지 모르겠습니다
294,295,20210408,2021,04,08,1,아니 앱을 깔자마자 짜증이 치밀어 오르네요 동의가 필수도 아닌게 거부버튼은 없질않나 로그인 방식변경에서 동의안함 누르니 로딩이 계속 돌아가면서 다음창으로 안넘어가지는데 이럴거면 강제필수라고 하지 왜 선택이라고 되어있나요? 짜증나도 걍 atm기나 쓰렵니다. 최악의 어플입니다.
295,296,20191201,2019,12,01,2,"이틀전부터 앱을 실행하려고만 하면 어플을 열 수 없다는 경고만 뜨길래 지웠다가 다시 설치하려고 했더니, 문제가 있어 설치할 수 없다네요. 다른 분들도 어플 실행에 문제를 겪고 계신 듯한데, 빨리 해결해 주시길 바랍니다"
296,297,20190328,2019,03,28,1,지문인식방식을 사용하고있습니다. 앱 실행 후 지문인식 화면이 나왔을때 뒤로가기를 했을경우 지문인식5회실패 알림이 뜨면서 기기재등록을 해야하더군요. 개선가능할까요. 너무 불편하네요
297,298,20190524,2019,05,24,3,바로이체 기능은 아무리해도 안되서 상담사와 통화하니 안드로이드 버전 7.1 이상에서 가능하다네요. 거의 최신폰만 가능한기능인데 그럼 미리 자세한 공지를해줘야죠 생고생했어요.
298,299,20201112,2020,11,12,1,업뎃 좀 하지마라~~ 빨라진다 그러구 더 느려지고 편리해진다더니 이체정보 한화면에서 볼때가 훨씬 편리했었음~~(화면 세번 거쳐야뎀)안티가 업뎃하는 수준~ 개발자는 분명 다른 어플 쓸거임
299,300,20201125,2020,11,25,1,아 생각할수록 열받네. 왜 이체에서 스피드이체가 안됨? 스피드 이체하려면 관리로 들어가야하던데? 그것도 여러개 중복해서 스피드 이체도 불가능하고 하나하나씩? 진짜 일 뭐같이 하네요.. 리뷰안보임? 다들 불평 불만 대단한거? 당장 내일 고치지 않으면 고객 다 빠져나갈듯 이따위로 바꿀꺼면 일하지 마라
300,301,20181221,2018,12,21,3,"이체하려는데, 계속 로그인 다시하라고 나오네요. 몇 시간째 동일증상 반복. 스마트폰 재부팅 해도 계속 안됨. 일시적 장애인가 싶어서 몇시간 기다려봐도 안됨. 결국 앱삭제후 다시 설치 후 정상 작동 되네요."
301,302,20201216,2020,12,16,1,잘 사용하다 업데이트 후 조회하기나 이체하기를 해봐도 하얀 창에서 넘어가지않고 아무것도 안뜹니다. 와이파이나 데이터 상태에서도 똑같고 재설치 해도 먹통입니다.
302,303,20210328,2021,03,28,1,갤럭시 S10플 사용자입니다. 오늘 갑자기 무선상의 일시적인 문제로 다시 시작하라고 계속 나오고 은행앱 접속이 안됩니다. V3 문제인 것 같기도 하고 삼성 최적화와 연관된 것 같기도 한데 빠른 해결 바랍니다.
303,304,20200307,2020,03,07,2,장난하나 진짜 사진등록 하래서 하려는데 갑자기 렉 걸리더니 꺼져. 장기간 이용을 안해서 안전을 위해 꺼졌대. 아 내가 너무 늦게 했나 싶어서 엄청 빠르게 해봤고 총 4번 해봤는데 계속 사진 올리는 부분에서 꺼져벌임..;; 매우매우 속상함..;;
304,305,20210125,2021,01,25,1,갑자기 접속안되요. 서버에서 오류가 생겼다고 하고튕김.. 와이파이 접속 -> 서버오류 데이터 접속 -> 무한로딩 어플 삭제후 재설치 -> 동일한 현상 업데이트 유무 -> 최신버전 설치 폰기종 : 갤노트9
305,306,20200305,2020,03,05,1,아.. 앱실행만 하면 로그인 되는 점이 편해서 그렇게 사용하고 있었는데 지금 급여 들어와서 확인해보니 로그인도 다 되지도 않고 아이디 패스워드로 로그인했더니 해당 방식으로는 이체가 안된다고 하면서 지문도 뭣도 등록 해놓은거 하나도 안되네요 정말 어떡하자는건지 모르겠네요
306,307,20210913,2021,09,13,1,"접속 오류, 튕김, 이벤트 오류 갈수록 더 안 좋아지네요. 특히 신한플러스는 바뀔 때마다 인터페이스가 보기에/사용하기에 불편해지는데 UI/UX 고려 안 하는 것 같네요"
307,308,20220712,2022,07,12,1,일단 어플 접속이 너무 안 됩니다. 그리고 다시 깔면 그날 걸었던 만보 데이터가 다 없어지는 것도 문제 아닌가요? 지금 몇번째 만보걷기 데이터 날리는지 모르겠어요. 이렇게 안 좋은 리뷰가 달리는데 근본적인 해결책을 강구하셔야할 것 같아요. 지금 지난 달부터 계속이네요.
308,309,20220715,2022,07,15,2,업데이트를 한 이후로 어플 접속 자체가 안됩니다... 접속화면에서 무한로딩 되거나 그냥 화면이 멈추네요. 이벤트 참여도 못하고있을 뿐더러 그냥 잔액 확인이나 이체 조차도 못하고있어요...
309,310,20220713,2022,07,13,1,어제부터 실행 후 모든 메뉴를 누르면 먹통이 되는데 어떡해야하는건가요??? 계속 로딩만 뜨면서 화면진행이 안됩니다 그전까지 매일같이 자주 문제없이 잘써왔는데 하루아침에 왜이런거죠 기기변경도 안했는데 업뎃때문인가요??? 불편해미치는 중입니다
310,311,20220720,2022,07,20,1,핸 폰 지문 변경으로 쏠에서 지문 변경진행을 위해 개인정보 확인단계를 지난후 모바일 OTP 발급화면으로 진행되어 로그인을 할수가 없습니다. 다은 방법으로 변경을 하려고해도 계속 모바일 OTP발급으로 들어가서 로그인 불가 ..
311,312,20220704,2022,07,04,5,오류수정돼서 별점 변경함/ 갑자기 신한플러스 접속이 안됩니다. 삭제 후 다시 실행했을때 1회만되고 또 안되네요.. 빠른 오류 수정 바랍니다. 앱자체는 만족하면서 계속 사용중입니다.
312,313,20220722,2022,07,22,1,정말 2022-07-19일에 업데이트되고 화면이 켜지지 않아서 삭제하고 다시 다운 받으니 겨우 열리네요 미션플러스 오픈하고는 화면이 안열리고 멈출때가 있더니 이젠 업데이트를 했더니 아예 업플이 열리지가 않네요 계속 렉이 있는데 이런부분 개선은 안하시나요 리뷰 보니 이렇게 렉이 심한데 답변은 확인이 안된다 이런문제가 빈번하게 일어나는데 조치는 없이 확인이 안됩니까 말이되나요 이렇게 렉이 심한데 차라리 미션플러스를 빼던지 정말 심각해요
313,314,20220708,2022,07,08,1,아니 로그인을 하려는데 신분증 사진을 찍으라 해서 한 50번은 찍었더니만 신분증에 쓰여있는 번호들을 인식 못해서 계속 생년월일이 다르다니 주민번호 뒷자리가 다르다니 하는데 뭐 이딴 쓰레기같은 시스템을 만들어놨어요? 인식도 제대로 안되면 이딴 쓰레기 같은건 쓰지도 말아야지 하필이면 왜 이런 덜떨어진 방식으로 로그인을 하게 만드는 걸까요? 네?
314,315,20220707,2022,07,07,1,어플 들어가서 지문인식하면 화면이 넘어가다가 다시 지문인식 화면으로 돌아왔다가 블랙아웃됩니다 . 개선부탁드립니다
315,316,20220720,2022,07,20,1,어제부터 앱 접속이 안되네요 앱을 열면 첫화면에서 무한로딩만 되고 앱안열림 저번에는 그나마 앱은 열리고 신한플레이만 안열리더니 이제는 아에 앱자체를 안열리게 만들어놨네요 ㅋ. 제대로 좀 합시다 해결방안도 좀 알려주시구요
316,317,20220522,2022,05,22,2,유투브도 재생이 잘되고 농협따리도 이상이 없는데 데이터 전송실패 뜸 자주. 그리고 상세내역 조회하는데 입출금 을 출 입 둘중하나 설정하면 기간이 초기화됨. 농협따리도 상세조회 이메일로 보내기 하면 지정날짜전체 보내지는데(더보기눌러야하지만) 신한은 스크롤 다 내려도 내가 보는 화면만 전송됨. 농협따리도 월별 총 입출금액 본 기능있는데 없음. 조회창에 없고 다른 창에 있는거면 문제있는거
317,318,20220620,2022,06,20,1,신한플러스로 넘어갈려고 하면 멈춥니다. 계속 멈쳐있어요. 답답합니다. 인터넷 설정 가서 스마트 태스킹 방지 안함하고 핸드폰 다시 시작하기로 전원 껐다 다시 켜면 신한플러스로 들어가져요. 근데요. 저희 가족꺼는 다 항상 스마트 태스킹 방지로 체크하고 보안설정 엄격으로 해놔도 잘 들어가지는데 도대체가 뭐가 문제인가요?! 해결 좀 해주세요 ..
318,319,20220709,2022,07,09,1,모바일 otp 발급 안되는 시간에는 그냥 신규발급자체를 다 막아놓으세요 지문 추가했다가 문자만 네개 날렸네 cti연동실패는 또 뭔데 걍 사람 돌아버리게 만드네 아 팁) 그냥 어플 삭제하고 재설치하면서 새로 재가입하면 위의 불편함이 없습다. 기존에 가입한 사람이 지문을 추가하는게 왜 신규가입자보다 인증이 까다로울까요?
319,320,20220721,2022,07,21,1,와..진짜 앱을 왜 이따위로 만든건지...폰 바꿔서 새로 시작하려니까 휴대폰번호인증 하라는데..수십번 반복해도 번호인증 실패했다고 뜨네...장난치는것도 아니고...다른인증방식 선택도 없고...돌아버린다 진짜...ㅋㅋ
320,321,20220611,2022,06,11,1,"금융 앱 중에 압도적 쓰레기. 시스템도 직관적이지 않고, 오류가 너무 많음. 챗봇 사용하려면 장시간 이용하지 않아 다시 시도하라는 메세지만 계속 반복. 나이도 입력된 정보와 다르게 미성년자로 인식됨"
321,322,20220530,2022,05,30,1,기존 핸드폰에서 지문재등록을했어요. 쏠 로그인방식에서 지문 선택해서 지문등록 했는데 10번넘게 지문등록만하네요 ㅋㅋㅋㅋ 핸드폰 문자인증도 끝없이하고 바보가 되는 기분이에요. 핸드폰 전원껐다켜도 동일하구요.
322,323,20220520,2022,05,20,1,지문 재등록 안됨. 인증만 5번째ㅡㅡ 지문 재등록이 안된다니까 답변으로 재등록을 하라고 답변을 다네ㅋㅋ 본인인증 하면 아무것도 안뜸 로그인인증방식 선택 -> 지문 신규 등록 선택 -> 휴대폰 본인인증 -> 휴대폰 문자 인증 -> OTP 비밀번호 입력 -> 로그인인증방식 선택 무한반복 한달전에 해보고 다시해보는데 아직도 개선된게 하나도없음 리뷰 보면 3월부터 나같은 현상으로 보이는 리뷰가 많은데도 아직도 개선이 안된것보면 개선의 의지가 없는듯
323,324,20220624,2022,06,24,1,만보기 실행하고 나서부터는 신한플러스에 들어가면 이미지가 안보이고 화면이 깨져요 앱을 강제종료하고 캐시까지 삭제해야 정상적으로 보이고 시간이 조금 지나면 다시 화면이 깨지네요 그리고 앱이 너무 느려요 개선 및 최적화 좀 하세요
324,325,20220717,2022,07,17,1,로그인이 안돼요 -그 전 부터 지금까지 계속 안돼요 -삭제하고 다시 설치하니 되긴하네요 어플이 너무 불안정해서 적금두번들어간거 그냥 해지했어요 다른은행 이용해야겠네요 다시설치하니 신한만보기도 0걸음으로 초기화 됐네요 흠 7월17일-삭제하고 재설치 당일만 되고 또 같은문제 반복이네요 로그인자체가 안됨 어휴
325,326,20220719,2022,07,19,1,"만보걷기 생긴 후로 앱 접속자체가 잘 힘듭니다. 몇 번을 지우고 다시 깔았는데, 아랫분 말씀처럼 깔고 첫 날은 접속되다가 다음날 다시 로그인 로딩에서 멈추네요... 만보기오류 심각한 듯 못써먹겠네요 이거 ㅡㅡ"
326,327,20220610,2022,06,10,1,핸드폰 바꾼 후 공동인증서 등록을 위해 타행/타기관 인증서 등록 화면 클릭후 NPKI 인증서 복사 하기 눌러서 복사까지 성공했으나 다음 화면(타기관 인증서 등록 화면) 으로 넘어가지 않고 계속 같은페이지 (NPKI복사 페이지) 에 머물러 있어서 상단의 X 를 누르거나 뒤로 가기를 누르면 인증/보안 센터 첫페이지가 나옵니다. (이후 동일하게 시도시 계속 같은 현상 반복) 최근 아래에 댓글남겨주신분도 같은 증상이신것 같은데 해결이 안 된것 같습니다. 상기 내용 확인 후 빠른 조치 요청 드립니다. 이체를 못하고 있네요. (갤럭시 A53기종) 답변후 수정 드립니다. 타행공동인증서는 인증기간이 남아있으며 타은행어플에서 문제없이 사용중입니다. 타 은행 어플에서 인증서 PC 로 내보내기 후 다시 쏠로 복사해봐야겠네요
327,328,20220710,2022,07,10,2,가끔씩 자주 로딩만되구 열리지가않아요 삭제하고 다시설치해도 동일 증상이 자주나네요 너무불편합니다
328,329,20220729,2022,07,29,4,"잘쓰고 있는데요, 7월 중순? 부터 로그인할때 멈추면서 검정화면으로 변하고 첫화면이 나오는데 왜그런가요?? 앱 삭제 후 재설치 해야할까요?? 첫화면 나오고도 좀 로딩이 걸리네요.."
329,330,20220720,2022,07,20,1,아니 편하게 사용 잘하고있었는데 도대체 뭐죠?'' 이상한 문자 보내고 인증번호 받으려하는데 인증번호 문자도 안오고 도대체 신한 왜 그러는거죠? 신한카드앱도 이상하게 되서 삼성페이로 농협카드만 사용한지 오래되었는데 왜 들어가지지않는거죠? ㅡ.ㅡ
330,331,20220711,2022,07,11,1,"비대면 실명 인증이 더럽게 안 돼서 포기했습니다. 그것 때문에 몇 시간을 날렸네요. 신분증 글자 인식을 잘 못하고, 어쩌다 운 좋게 글자 인식이 제대로 돼도 뭐가 문제인지 알려주지도 않고 계속 실패..."
331,332,20220705,2022,07,05,3,"신한 전화ars 적용할때부터 오류가 계속 나오네요. 만보기 에러 때문에 조회,입금,접속등 메인 메뉴들이 않되니 고쳐주시거나 중지 안되면 없애주세요. 만보기 몇점 포인트 얻으려다 황당합니다. 관계자 테스트 핸드폰에 며칠 확인 좀 해 보고 업데이트 적용 해주세요."
332,333,20220705,2022,07,05,1,얼마전부터 신한쏠앱이 1주-2주에 한번 간격으로 먹통이 됩니다 그때마다 설치삭제하고 다시 설치하고 앱인증서재발급절차 진행한게 벌써 다섯번째입니다 너무 불편해요 농협과 신한은행 앱 이용중인데 농협앱은 한번도 이런일이 없었습니다 신한은행앱만 이렇게 불편하게 쓰고있습니다 폰에 앱도 많이 깔려있지 않고 메모리도 넉넉합니다 정말 개선이 시급합니다
333,334,20220704,2022,07,04,1,"만보기때문에 업데이트하라고 하여 억지로 하였는데, 어제 업데이트 후 신한은행 어플에서 로그인하면, ""꿈과 열정이 멋진 세상을 만들 거예요"" 에서 넘어가질 않습니다. 괜히 업데이트한 것 같은데 원래 버전으로 못돌리나요.."
334,335,20220627,2022,06,27,1,예전에는 안 그랬는데.. 요새 어플을 켜면 계속 로딩이 되고 어플에 들어가지지 않아요... 신한플러스도 잘 안들어가지고요... 계속 이렇게 어플 사용이 어려우면 은행을 갈아타야할 것 같아요. 개선 부탁드려요.
335,336,20220524,2022,05,24,1,갑자기 지문 인증을 새로하라니... 지문 정보는 바뀐게없는데도요ㅠㅠㅠ? 우선 재등록하려고 본인인증 했는데 그래도 계속해서 지문 등록 새로하라고만 나오네요. 그때마다 또 본인인증 본인인증... 결국 지문 등록도 안되고 사용도 불가합니다.
336,337,20220622,2022,06,22,1,"새로운 기기에서 로그인 하는거 뭐 이리 이상하게 만듬? 폰 새로 사서 어플들 로그인하는데, 국민은행을 주로 써서 국민은행 먼저 로그인하고 공동인증서 발행, 그 다음에 신한 로그인 하려니간 타행 인증서라 안된대? 타행 인증서 등록하라네? 등록하려니간 뭐 OTP 때문에 안됨. 그래서 기존 폰에 있던 인증서 불러오기 하니깐 그것도 안됨. 인증서 로그인 포기하고 아이디 만들어서 로그인하려고 했더니 아이디로 로그인했더니 인증서로 인증하라네? 하 계속 돌고돌아 같은 자리만 뺑뺑이 도네요. 이거 어쩌라는 말임?? 그리고 인증하는데 전화나 문자 인증하면 되지 로그인도 못해서 계좌번호도 못 보는데 계좌 번호로 어케 인증하라는거? 주로 쓰는 계좌 정도는 외우는데 뭐 모든 계좌 번호를 어케 외움? 어플 로그인 못해서 계좌를 못 보는데 계좌 번호 대라는건 뭐 어케 대라는건지 ㅋㅋ 기존 폰 + 새 폰 두개 들고 몇 시간이나 뺑뺑이 치는데 로그인 못함 ㅋㅋㅋ 아니 뭐 새로운 기기 로그인 하는걸 뭐 이렇게 만"
337,338,20220627,2022,06,27,1,업데이트전엔 잘사용했는데 신한플레이로 들어갈려면 계속 도는 화면만 나오네요 매번 로그아웃하고 다시 로그인해야만 하나요??? 언제쯤 정상화될지 짜증나네요
338,339,20220531,2022,05,31,3,아니 인증서 업데이트 이후 지문로그인 안되잖아요. 등록하래서 했더니 재등록후 이용할수있다뇨? 무한루프에 빠지잖아요. 수정: 기존 바이오인증서 지우고 신규지문등록하니까 되네요. 이런건 안내좀 해주셨으면 좋겠습니다.
